{
  "schemaVersion": 1,
  "id": "create-product-flow",
  "version": "1.0.0",
  "title": "Create Product Flow",
  "description": "Shape a multi-screen UX flow and create coherent draft screens.",
  "stateSchema": "KotikitGraphState/v1",
  "requiredCapabilities": [
    "brief.write",
    "designSystem.search.local",
    "designSystem.fit",
    "draftComponents.write",
    "figma.target",
    "draft.compile"
  ],
  "nodes": [
    {
      "id": "capture-goal-actor-scenario",
      "uses": "flow.captureGoalActorScenario",
      "params": {}
    },
    {
      "id": "map-user-flow",
      "uses": "flow.mapUserFlow",
      "params": {}
    },
    {
      "id": "identify-screens-and-states",
      "uses": "flow.identifyScreensAndStates",
      "params": {}
    },
    {
      "id": "search-local-design-system",
      "uses": "designSystem.searchLocal",
      "params": {}
    },
    {
      "id": "build-fit-report",
      "uses": "designSystem.buildFitReport",
      "params": {}
    },
    {
      "id": "ask-missing-component-decision",
      "uses": "designSystem.askMissingComponentDecision",
      "params": {}
    },
    {
      "id": "plan-missing-components",
      "uses": "draftComponents.planMissing",
      "params": {}
    },
    {
      "id": "ensure-draft-target",
      "uses": "figma.ensureDraftTarget",
      "params": {}
    },
    {
      "id": "create-draft-components",
      "uses": "draftComponents.createOnDraftPage",
      "params": {}
    },
    {
      "id": "validate-draft-components",
      "uses": "draftComponents.validateCreated",
      "params": {}
    },
    {
      "id": "compile-high-fidelity-draft",
      "uses": "draft.compileHighFidelityDraft",
      "params": {}
    },
    {
      "id": "draft-screens-incrementally",
      "uses": "draft.draftScreensIncrementally",
      "params": {}
    }
  ],
  "edges": [
    ["capture-goal-actor-scenario", "map-user-flow"],
    ["map-user-flow", "identify-screens-and-states"],
    ["identify-screens-and-states", "search-local-design-system"],
    ["search-local-design-system", "build-fit-report"],
    ["build-fit-report", "ask-missing-component-decision"],
    ["ask-missing-component-decision", "plan-missing-components"],
    ["plan-missing-components", "ensure-draft-target"],
    ["ensure-draft-target", "create-draft-components"],
    ["create-draft-components", "validate-draft-components"],
    ["validate-draft-components", "compile-high-fidelity-draft"],
    ["compile-high-fidelity-draft", "draft-screens-incrementally"]
  ],
  "start": "capture-goal-actor-scenario",
  "end": ["draft-screens-incrementally"],
  "safetyProfile": "product-flow-draft"
}
