{
  "schemaVersion": 1,
  "id": "improve-existing-design",
  "version": "1.0.0",
  "title": "Improve Existing Design",
  "description": "Review an existing Figma target and apply approved revisions.",
  "stateSchema": "KotikitGraphState/v1",
  "requiredCapabilities": [
    "figma.target",
    "figma.read.remote",
    "designSystem.search.local",
    "review.write",
    "figma.write.remote",
    "qa.run"
  ],
  "nodes": [
    {
      "id": "collect-evidence",
      "uses": "review.collectEvidence",
      "params": {}
    },
    {
      "id": "search-local-design-system",
      "uses": "designSystem.searchLocal",
      "params": {}
    },
    {
      "id": "compare-to-design-system",
      "uses": "review.compareToDesignSystem",
      "params": {}
    },
    {
      "id": "group-findings",
      "uses": "review.groupFindings",
      "params": {}
    },
    {
      "id": "create-revision-plan",
      "uses": "review.createRevisionPlan",
      "params": {}
    },
    {
      "id": "ask-revision-approval",
      "uses": "review.askApproval",
      "params": {}
    },
    {
      "id": "apply-approved-revisions",
      "uses": "review.applyApprovedRevisions",
      "params": {}
    },
    {
      "id": "run-ui-quality-gate",
      "uses": "qa.runUiQualityGate",
      "params": {}
    },
    {
      "id": "post-revision-qa",
      "uses": "qa.postDraftQa",
      "params": {}
    }
  ],
  "edges": [
    ["collect-evidence", "search-local-design-system"],
    ["search-local-design-system", "compare-to-design-system"],
    ["compare-to-design-system", "group-findings"],
    ["group-findings", "create-revision-plan"],
    ["create-revision-plan", "ask-revision-approval"],
    ["ask-revision-approval", "apply-approved-revisions"],
    ["apply-approved-revisions", "run-ui-quality-gate"],
    ["run-ui-quality-gate", "post-revision-qa"]
  ],
  "start": "collect-evidence",
  "end": ["post-revision-qa"],
  "safetyProfile": "approved-design-revision"
}
